{
  "schema_version": "1.0",
  "event_id": "nexus003-1111-4111-1111-000000000007",
  "timestamp": "2026-10-11T04:32:17Z",
  "source": "quantum-multiversal-nexus",
  "type": "capability.report",
  "classification": "PROPOSED",
  "correlation_id": null,
  "provenance": {
    "repository": "onegayunicorn/quantum-multiversal-nexus",
    "revision": "codex/integration-contract-v1@9c8d7e6",
    "evidence_uri": "docs/manifest/6-domains.md"
  },
  "payload": {
    "domain": "ecosystem-coordination",
    "status": "proposed",
    "note": "nexus describes; platform must verify before execution"
  }
}
